{
  "schema": "skillgendev.page/1",
  "route": "/apply",
  "skill": "bench-apply",
  "title": "Bench application",
  "app": {
    "name": "Bench",
    "url": "http://localhost:8765"
  },
  "purpose": "Applies for a Bench account. Submitting sends the application to the server, which checks the username is free.",
  "version": 1,
  "sections": [
    {
      "id": "applicant",
      "label": "Applicant",
      "fields": [
        "full_name",
        "email",
        "username",
        "birth_date",
        "bio"
      ]
    },
    {
      "id": "organisation",
      "label": "Organisation",
      "fields": [
        "account_type",
        "company_name",
        "registration_no",
        "team_size"
      ]
    },
    {
      "id": "location",
      "label": "Location",
      "fields": [
        "country",
        "region",
        "city"
      ]
    },
    {
      "id": "preferences",
      "label": "Preferences",
      "fields": [
        "interests",
        "department",
        "skills",
        "newsletter"
      ]
    },
    {
      "id": "statement",
      "label": "Statement",
      "fields": [
        "statement"
      ]
    },
    {
      "id": "references",
      "label": "References",
      "fields": [
        "references[].name",
        "references[].email"
      ]
    },
    {
      "id": "documents",
      "label": "Documents",
      "fields": [
        "id_document"
      ]
    },
    {
      "id": "declaration",
      "label": "Declaration",
      "fields": [
        "agree_terms"
      ]
    }
  ],
  "groups": [
    {
      "id": "references",
      "label": "Reference",
      "row_selector": ".reference-row",
      "add_selector": "#add-reference",
      "min_rows": 1
    }
  ],
  "fields": {
    "full_name": {
      "label": "Full name",
      "means": "The applicant's full name",
      "type": "text",
      "required": true,
      "limits": {
        "min_length": 3,
        "max_length": 80
      },
      "strategy": "native-input",
      "selector": "#full_name",
      "section": "applicant",
      "source": [
        "EXTRACTED",
        "RUNTIME_PROBED"
      ],
      "confidence": 0.985
    },
    "email": {
      "label": "Email",
      "means": "Where the applicant receives updates",
      "type": "email",
      "required": true,
      "strategy": "native-input",
      "selector": "#email",
      "section": "applicant",
      "source": [
        "EXTRACTED",
        "RUNTIME_PROBED"
      ],
      "confidence": 0.985
    },
    "username": {
      "label": "Username",
      "type": "text",
      "format": "3–20 lowercase letters, digits or underscores",
      "required": true,
      "limits": {
        "pattern": "[a-z0-9_]{3,20}"
      },
      "strategy": "native-input",
      "selector": "#username",
      "section": "applicant",
      "notes": "must be unique; the server rejects names already taken",
      "server_checked": true,
      "source": [
        "EXTRACTED",
        "RUNTIME_PROBED"
      ],
      "confidence": 0.985
    },
    "birth_date": {
      "label": "Date of birth",
      "type": "date",
      "format": "YYYY-MM-DD",
      "required": true,
      "strategy": "native-input",
      "selector": "#birth_date",
      "section": "applicant",
      "source": [
        "EXTRACTED",
        "RUNTIME_PROBED"
      ],
      "confidence": 0.985
    },
    "bio": {
      "label": "Short bio",
      "type": "long-text",
      "limits": {
        "max_length": 500
      },
      "strategy": "native-input",
      "selector": "#bio",
      "section": "applicant",
      "source": [
        "EXTRACTED",
        "RUNTIME_PROBED"
      ],
      "confidence": 0.85
    },
    "account_type": {
      "label": "Account type",
      "type": "enum",
      "options": [
        "Individual",
        "Company"
      ],
      "required": true,
      "strategy": "choice",
      "selector": "input[name=\"account_type\"]",
      "section": "organisation",
      "notes": "Company shows the company fields",
      "source": [
        "EXTRACTED",
        "RUNTIME_PROBED"
      ],
      "confidence": 0.85
    },
    "company_name": {
      "label": "Company name",
      "type": "text",
      "required_if": {
        "field": "account_type",
        "op": "in",
        "values": [
          "Company"
        ]
      },
      "visible_if": {
        "field": "account_type",
        "op": "in",
        "values": [
          "Company"
        ]
      },
      "strategy": "native-input",
      "selector": "#company_name",
      "section": "organisation",
      "source": [
        "EXTRACTED",
        "RUNTIME_PROBED"
      ],
      "confidence": 0.85
    },
    "registration_no": {
      "label": "Registration number",
      "type": "text",
      "format": "two capital letters then six digits, like AB123456",
      "required_if": {
        "field": "account_type",
        "op": "in",
        "values": [
          "Company"
        ]
      },
      "visible_if": {
        "field": "account_type",
        "op": "in",
        "values": [
          "Company"
        ]
      },
      "limits": {
        "pattern": "[A-Z]{2}[0-9]{6}"
      },
      "strategy": "native-input",
      "selector": "#registration_no",
      "section": "organisation",
      "source": [
        "EXTRACTED",
        "RUNTIME_PROBED"
      ],
      "confidence": 0.85
    },
    "team_size": {
      "label": "Team size",
      "type": "enum",
      "options": [
        "1–10",
        "11–50",
        "51–200",
        "201 or more"
      ],
      "visible_if": {
        "field": "account_type",
        "op": "in",
        "values": [
          "Company"
        ]
      },
      "strategy": "native-select",
      "selector": "#team_size",
      "section": "organisation",
      "source": [
        "EXTRACTED",
        "RUNTIME_PROBED"
      ],
      "confidence": 0.85
    },
    "country": {
      "label": "Country",
      "type": "enum",
      "options": [
        "Atlantis",
        "Borduria",
        "Freedonia",
        "Genovia"
      ],
      "required": true,
      "strategy": "native-select",
      "selector": "#country",
      "section": "location",
      "notes": "controls the Region list",
      "source": [
        "EXTRACTED",
        "RUNTIME_PROBED"
      ],
      "confidence": 0.985
    },
    "region": {
      "label": "Region",
      "type": "enum",
      "required": true,
      "options_from": {
        "depends_on": "country",
        "load": "async",
        "pick_by": "text"
      },
      "strategy": "native-select",
      "selector": "#region",
      "section": "location",
      "notes": "list loads from the server after Country is chosen",
      "source": [
        "EXTRACTED",
        "RUNTIME_PROBED"
      ],
      "confidence": 0.985
    },
    "city": {
      "label": "City",
      "type": "enum",
      "required": true,
      "options_from": {
        "depends_on": "",
        "load": "async",
        "pick_by": "text"
      },
      "strategy": "aria-combobox",
      "selector": "#city",
      "section": "location",
      "notes": "searchable; type the name and pick from the list",
      "source": [
        "EXTRACTED",
        "RUNTIME_PROBED"
      ],
      "confidence": 0.85
    },
    "interests": {
      "label": "Interests",
      "type": "multi-enum",
      "options": [
        "Design",
        "Engineering",
        "Research",
        "Sales",
        "Support"
      ],
      "strategy": "choice",
      "selector": "input[name=\"interests\"]",
      "section": "preferences",
      "source": [
        "EXTRACTED",
        "RUNTIME_PROBED"
      ],
      "confidence": 0.85
    },
    "department": {
      "label": "Department",
      "type": "path",
      "format": "path through the tree, like Engineering / Platform / Reliability",
      "options": [
        "Engineering / Platform / Reliability",
        "Engineering / Platform / Tooling",
        "Engineering / Product / Web",
        "Engineering / Product / Mobile",
        "Operations / Finance",
        "Operations / People",
        "Research"
      ],
      "required": true,
      "strategy": "aria-tree",
      "selector": "#department",
      "section": "preferences",
      "source": [
        "EXTRACTED",
        "RUNTIME_PROBED"
      ],
      "confidence": 0.85
    },
    "skills": {
      "label": "Skills",
      "type": "multi-enum",
      "options": [
        "Python",
        "JavaScript",
        "SQL",
        "Go",
        "Rust"
      ],
      "strategy": "aria-listbox",
      "selector": "#skills",
      "section": "preferences",
      "source": [
        "EXTRACTED",
        "RUNTIME_PROBED"
      ],
      "confidence": 0.85
    },
    "newsletter": {
      "label": "Send me the newsletter",
      "type": "boolean",
      "strategy": "native-input",
      "selector": "#newsletter",
      "section": "preferences",
      "source": [
        "EXTRACTED",
        "RUNTIME_PROBED"
      ],
      "confidence": 0.85
    },
    "statement": {
      "label": "Why are you applying?",
      "type": "rich-text",
      "required": true,
      "strategy": "rich-text",
      "selector": "#statement",
      "section": "statement",
      "source": [
        "EXTRACTED",
        "RUNTIME_PROBED"
      ],
      "confidence": 0.85
    },
    "references[].name": {
      "label": "Reference name",
      "type": "text",
      "strategy": "native-input",
      "selector": "input[data-field=name]",
      "section": "references",
      "group": "references",
      "source": [
        "EXTRACTED"
      ],
      "confidence": 0.85
    },
    "references[].email": {
      "label": "Reference email",
      "type": "email",
      "strategy": "native-input",
      "selector": "input[data-field=email]",
      "section": "references",
      "group": "references",
      "source": [
        "EXTRACTED"
      ],
      "confidence": 0.85
    },
    "id_document": {
      "label": "Identity document (PDF or JPG, up to 2 MB)",
      "type": "file",